,Name,Twitter Handle,Time,Content,Retweeting,Hashtags,Tagged,Links
1155,David McKinley,RepMcKinley,2021-06-20T13:09:00.000Z,"Happy 158th birthday West Virginia, almost Heaven &amp; the home we love. It’s been an honor to represent WV in the halls of Congress &amp; I am proud to have been born and raised in the Mountain State because, like John Denver said, its ‘Almost Heaven.’ 

Happy Birthday West Virginia! https://t.co/3BCTD4kbuO",",",",",",",",https://t.co/3BCTD4kbuO,"
1156,David McKinley,RepMcKinley,2021-06-20T12:11:00.000Z,"Happy Father's Day!

""A good father is one of the most unsung, unpraised, unnoticed, and yet one of the most valuable assets in our society."" – Rev. Billy Graham. https://t.co/0QaWFNuxMt",",",",",",",",https://t.co/0QaWFNuxMt,"
1157,Alex Mooney,RepAlexMooney,2021-06-20T13:18:30.000Z,"Happy Birthday West Virginia! Celebrating 158 years of our #MountainState.

#WV https://t.co/HJ0790qR3f",",",",MountainState,WV,",",",",https://t.co/HJ0790qR3f,"
1158,Alex Mooney,RepAlexMooney,2021-06-20T12:28:35.000Z,"Happy Father’s Day! I hope fathers and grandfathers across #WV02 have a day filled with family and loved ones.

#FathersDay2021 https://t.co/WGWsZHmlhy",",",",WV02,FathersDay2021,",",",",https://t.co/WGWsZHmlhy,"
1159,Alex Mooney,RepAlexMooney,2021-06-19T12:28:50.000Z,"Join me today in honoring Juneteenth, a day to recognize the end of slavery in America. It is important to remember our history. I’m proud to live in America, where we honor liberty and freedom.",",",",",",",","
1160,Carol Miller,RepCarolMiller,2021-06-20T17:00:00.000Z,"Happy Birthday, West Virginia! 

I hope all West Virginians are enjoying this wonderful day celebrating our great state. From the rolling hills to roaring rivers and everything in between, we are blessed to call beautiful #WV home. #AlmostHeaven #WVDay https://t.co/A6aSm3RdN1",",",",WV,AlmostHeaven,WVDay,",",",",https://t.co/A6aSm3RdN1,"
1161,Carol Miller,RepCarolMiller,2021-06-20T14:00:00.000Z,Happy #FathersDay to the dads with us today and the ones in our hearts. https://t.co/gtvJQ7H4uZ,",",",FathersDay,",",",",https://t.co/gtvJQ7H4uZ,"
1162,Carol Miller,RepCarolMiller,2021-06-19T13:30:00.000Z,"On this day in 1865, the last slaves in Texas were freed - ending slavery in the United States. Today and every day, we celebrate that freedom and honor the important meaning of this historic day. #JuneTeenth2021 https://t.co/jDwpHFAldf",",",",JuneTeenth2021,",",",",https://t.co/jDwpHFAldf,"
1163,Bryan Steil,RepBryanSteil,2021-06-20T20:52:17.000Z,Happy Father’s Day! https://t.co/xRdN3g3wu5,",",",",",",",https://t.co/xRdN3g3wu5,"
1164,Bryan Steil,RepBryanSteil,2021-06-20T03:49:28.000Z,Great win! Go Bucks! #FearTheDeer https://t.co/ToxG3qSDHM,",",",FearTheDeer,",",",",https://t.co/ToxG3qSDHM,"
1165,Bryan Steil,RepBryanSteil,2021-06-20T00:42:35.000Z,Had a great time at the Walworth County Dairy Breakfast this morning! https://t.co/4GkBegKFtR,",",",",",",",https://t.co/4GkBegKFtR,"
1166,Bryan Steil,RepBryanSteil,2021-06-19T19:51:18.000Z,"Great celebrating Juneteenth in Racine. On June 19, 1865 Union troops arrived in Galveston, Texas to liberate all African American slaves. Juneteenth commemorates the end of slavery in the United States. https://t.co/5EW2XtStFP",",",",",",",",https://t.co/5EW2XtStFP,"
1167,Mark Pocan,RepMarkPocan,2021-06-20T15:29:57.000Z,Wishing a happy #FathersDay to all the dads &amp; father figures in Wisconsin and across the country! https://t.co/x3rdjYhDtP,",",",FathersDay,",",",",https://t.co/x3rdjYhDtP,"
1168,Mark Pocan,RepMarkPocan,2021-06-19T17:25:26.000Z,"RT @Public_Citizen: A federal holiday alone is not enough. As we honor Juneteenth, the fight continues for voter protection and expansion,…",",Public_Citizen,",",",",",","
1169,Mark Pocan,RepMarkPocan,2021-06-19T16:23:44.000Z,"RT @RepGwenMoore: Happy #Juneteenth! I'm proud to be from Milwaukee, one of the first cities in the North to hold Juneteenth celebrations.…",",RepGwenMoore,",",",",",","
1170,Mark Pocan,RepMarkPocan,2021-06-19T15:13:02.000Z,"RT @CoriBush: As we celebrate Juneteenth, let’s make a collective commitment to Black freedom and liberation. 

Let’s start by investing in…",",CoriBush,",",",",",","
1171,Mark Pocan,RepMarkPocan,2021-06-19T15:11:46.000Z,"RT @RepRashida: Happy #Juneteenth! 156 years since the end of slavery, we must all commit to addressing the generational pain and suffering…",",RepRashida,",",",",",","
1172,Mark Pocan,RepMarkPocan,2021-06-19T15:10:35.000Z,"RT @JamaalBowmanNY: On today's #JuneTeenth2021, let's rejoice in our ancestors' fight for freedom.

But let's also set our sights on what w…",",JamaalBowmanNY,",",",",",","
1173,Ron Kind,RepRonKind,2021-06-20T15:38:35.000Z,Happy Father's Day to all the great dads across Wisconsin! https://t.co/iqebLFd6hr,",",",",",",",https://t.co/iqebLFd6hr,"
1174,Ron Kind,RepRonKind,2021-06-19T14:47:06.000Z,"On June 19, 1865, Major General Gordon Granger arrived in Galveston, TX, and announced the end of the Civil War and slavery in the United States 2½ years after the Emancipation Proclamation. Each year on June 19th, we commemorate #Juneteenth. https://t.co/imK8WapZ6d",",",",Juneteenth,",",",",https://t.co/imK8WapZ6d,"
1175,Gwen Moore,RepGwenMoore,2021-06-20T12:28:08.000Z,Happy Father's Day to every dad and person playing a father figure in someone's life!,",",",",",",","
1176,Gwen Moore,RepGwenMoore,2021-06-19T15:42:59.000Z,"Happy #Juneteenth! I'm proud to be from Milwaukee, one of the first cities in the North to hold Juneteenth celebrations. I joined our community in celebrating Juneteenth and its new designation as a national holiday! https://t.co/xH9mWI9xPb",",",",Juneteenth,",",",",https://t.co/xH9mWI9xPb,"
1177,Scott Fitzgerald,RepFitzgerald,2021-06-20T15:13:08.000Z,RT @RepGallagher: Reports that up to $400 billion in unemployment assistance may have been stolen during the pandemic are alarming. Yesterd…,",RepGallagher,",",",",",","
1178,Scott Fitzgerald,RepFitzgerald,2021-06-20T14:48:50.000Z,"RT @GOPLeader: People will die as a result of Biden's Border Crisis. There's been a 300% increase in fentanyl coming across, and that affec…",",GOPLeader,",",",",",","
1179,Glenn Grothman,RepGrothman,2021-06-20T16:25:00.000Z,"Happy #FathersDay  to my dad, Harold. I miss you every day. I hope all the dads across #Wisconsin have a great day! https://t.co/ncsypHxkBU",",",",FathersDay,Wisconsin,",",",",https://t.co/ncsypHxkBU,"
1180,Tom Tiffany,TomTiffanyWI,2021-06-20T00:37:24.000Z,"Lots of people rolling in to the iron River community center to join John, the fire chief, for the annual EMS fundraiser. Thanks to all the volunteers in Iron River for your service. https://t.co/piyMyUvbPi",",",",",",",",https://t.co/piyMyUvbPi,"
1181,Mike Gallagher,RepGallagher,2021-06-19T17:16:25.000Z,"156 years ago today, federal troops arrived in Galveston, TX and ensured all enslaved people were freed. On Juneteenth we remember this important day in our history and this critical story of hope and freedom for all. https://t.co/xdVJqRqtaX",",",",",",",",https://t.co/xdVJqRqtaX,"
1182,Tommy Tuberville,SenTuberville,2021-06-20T16:32:46.000Z,"No words can comfort the families and loved ones of these children during this tragedy. My family, staff, and the people of Alabama are praying for peace and comfort for all affected during this unimaginable time.https://t.co/4Sh0LspMlA",",",",",",",","
1183,Tommy Tuberville,SenTuberville,2021-06-20T14:55:45.000Z,Wishing all dads a Happy Father’s Day today https://t.co/AAmoIbheXn,",",",",",",",https://t.co/AAmoIbheXn,"
1184,Tommy Tuberville,SenTuberville,2021-06-19T20:28:20.000Z,RT @GovernorKayIvey: Reports indicate #TropicalStormClaudette destroyed about 50 homes in a mobile home park in Brewton. I’m praying for th…,",GovernorKayIvey,",",",",",","
1185,Tommy Tuberville,SenTuberville,2021-06-19T20:12:42.000Z,Please monitor your local news sources and stay safe. https://t.co/o5gwlYi7ji,",",",",",",",https://t.co/o5gwlYi7ji,"
1186,Tommy Tuberville,SenTuberville,2021-06-19T17:50:00.000Z,President Biden’s defense budget is disappointing. Our men and women in uniform deserve better. https://t.co/CrA9Gn1P8v,",",",",",",",https://t.co/CrA9Gn1P8v,"
1187,Tommy Tuberville,SenTuberville,2021-06-19T13:52:00.000Z,"Juneteenth commemorates the day slavery officially came to an end in America in 1865. Since that day, we’ve been trying to become a more perfect union. We should always learn and grow from history.

#JuneTeenth https://t.co/osqQc4IvFf",",",",JuneTeenth,",",",",https://t.co/osqQc4IvFf,"
1188,Lisa Murkowski,lisamurkowski,2021-06-20T14:45:18.000Z,"To all the fathers and father figures—thank you for what you do. I am blessed to have an extraordinary dad—a dad who has been there for me as counselor, mentor, and one who has loved me unconditionally. Happy #FathersDay to my dad and all of the fathers out there. https://t.co/7F8rC9OAEE",",",",FathersDay,",",",",https://t.co/7F8rC9OAEE,"
1189,Kyrsten Sinema,SenatorSinema,2021-06-20T22:00:00.000Z,It is our privilege to nominate exceptional Arizona students to the U.S Service Academies. We’re highlighting this year’s appointments including Jasper Marie Schineller to the U.S. Merchant Marines Academy. Thank you for keeping our country safe and secure. https://t.co/SIMAV43mmh,",",",",",",",https://t.co/SIMAV43mmh,"
1190,Kyrsten Sinema,SenatorSinema,2021-06-20T16:00:01.000Z,"Happy Father's Day, Arizona!",",",",",",",","
1191,Kyrsten Sinema,SenatorSinema,2021-06-19T20:00:00.000Z,"Tucsonans: as temperatures rise, you can visit one of the city’s cooling centers. Find a site near you:   
https://t.co/uSKu77bMvc",",",",",",",",https://t.co/uSKu77bMvc,"
1192,Kyrsten Sinema,SenatorSinema,2021-06-19T16:00:01.000Z,"On #Juneteenth, 156 years after the end of slavery in the United States, the promise of equality is still not a reality for many Americans. Today and every day, we’re working to advance our nation’s values: freedom, justice, and equal treatment under the law.",",",",Juneteenth,",",",","
1193,Mark Kelly,SenMarkKelly,2021-06-20T22:34:46.000Z,"Happy Father’s Day, Arizona! And especially to my fellow first-time grandfathers.",",",",",",",","
1194,Mark Kelly,SenMarkKelly,2021-06-19T16:03:28.000Z,"On #Juneteenth, it’s our responsibility to face the dark history of slavery in America and recognize that racism did not end with slavery, nor did it end with the passage of the Civil Rights Act. The work to form a more perfect union continues.",",",",Juneteenth,",",",","
1195,John Boozman,JohnBoozman,2021-06-20T13:29:55.000Z,"Happy #FathersDay to all dads in Arkansas and throughout our country. And whether you’re celebrating a father who’s still here or remembering one who isn’t, be sure to make this a day of honor + gratitude for role they play in our lives. Enjoy celebrating the gift of fatherhood. https://t.co/EjOSz4lAcu",",",",FathersDay,",",",",https://t.co/EjOSz4lAcu,"
1196,John Boozman,JohnBoozman,2021-06-19T20:12:14.000Z,RT @JohnBoozman: Yesterday @SecVetAffairs informed me @DepVetAffairs expects to implement the #veteran suicide prevention grant program I c…,",JohnBoozman,",",",",",","
1197,John Boozman,JohnBoozman,2021-06-19T20:12:02.000Z,"RT @JohnBoozman: I'm leading a bipartisan effort w/ @RonWyden to improve women #veterans health.

The SERVICE Act will help expand access t…",",JohnBoozman,",",",",",","
1198,John Boozman,JohnBoozman,2021-06-19T16:36:28.000Z,"RT @Isbellfarms: Here’s the full story from @KATVNews 

U.S. Sen. John Boozman visits Arkansas counties to assess flood damage https://t.co…",",Isbellfarms,",",",",",","
1199,John Boozman,JohnBoozman,2021-06-19T16:34:52.000Z,RT @FOX16News: Sen. Boozman tours Arkansas farms with flood damage https://t.co/UWM9dT9jdR,",FOX16News,",",",",",","
1200,John Boozman,JohnBoozman,2021-06-19T13:05:00.000Z,I’m pleased to join with Arkansans and all Americans to celebrate #Juneteenth https://t.co/pvsbOFGg7Z,",",",Juneteenth,",",",",https://t.co/pvsbOFGg7Z,"
1201,Tom Cotton,SenTomCotton,2021-06-19T15:15:19.000Z,"On this first national holiday of Juneteenth, let us all take pride in our great nation and the strides it has made to realize fully the promise of America.
https://t.co/6a2dHisHtB",",",",",",",",https://t.co/6a2dHisHtB,"
1202,Dianne Feinstein,SenFeinstein,2021-06-20T17:35:04.000Z,Happy #FathersDay to all the fathers and father-figures in California and around the country. Have a great day!,",",",FathersDay,",",",","
1203,Dianne Feinstein,SenFeinstein,2021-06-19T16:04:11.000Z,"On #Juneteenth I encourage everyone to learn about the history of this important date. @NMAAHC has great resources available online for young children, students and adults. Find more here: https://t.co/ad7Yd1z5nm",",",",Juneteenth,",",NMAAHC,",",https://t.co/ad7Yd1z5nm,"
1204,Alex Padilla,SenAlexPadilla,2021-06-20T18:55:35.000Z,Wishing all dads and father figures a Happy Father’s Day today. I especially appreciate special moments with the boys — like playing board games after a long week! https://t.co/oM1AuPGG8X,",",",",",",",https://t.co/oM1AuPGG8X,"
1205,Alex Padilla,SenAlexPadilla,2021-06-19T17:32:41.000Z,"#Juneteenth is a day to commemorate the milestones of freedom &amp; acknowledge the darkest moments of our past. 

It is also a day to recommit to justice for Black Americans in voting, housing, health care, employment, policing, &amp; more.

Only then can we celebrate true freedom.",",",",Juneteenth,",",",","
1206,Michael Bennet,SenatorBennet,2021-06-21T00:15:46.000Z,"Tomorrow is Child Tax Credit Awareness Day — and I'm holding a virtual roundtable with @SenSherrodBrown and @MomsRising. We'll discuss the transformative effect the expanded CTC will have on families across the country. 

Tune in tomorrow at 7:30am MT: https://t.co/R7U8SYjvSX",",",",",",SenSherrodBrown,MomsRising,",",https://t.co/R7U8SYjvSX,"
1207,Michael Bennet,SenatorBennet,2021-06-20T21:15:48.000Z,"Our nation is a republic founded on the premise of religious freedom and a society that for generations has called out to the tired, the poor, and the huddled masses yearning to be free. 

We must lead by example and live up to our ideals.",",",",",",",","
1208,Michael Bennet,SenatorBennet,2021-06-20T21:15:48.000Z,"On #WorldRefugeeDay, we as Americans recommit to our long-standing tradition of welcoming those fleeing violence, persecution, and suffering. 

For me this is personal. My mom and her parents sought to rebuild their lives in the United States after escaping the Holocaust.",",",",WorldRefugeeDay,",",",","
1209,Michael Bennet,SenatorBennet,2021-06-20T15:18:57.000Z,"The expanded #ChildTaxCredit is the most significant investment the federal gov't has made in American families and children in decades.

I hope you’ll join me for a discussion at 5pm MT tomorrow to learn more about it and ask any questions you have👉https://t.co/R7U8SYjvSX",",",",ChildTaxCredit,",",",","
1210,Michael Bennet,SenatorBennet,2021-06-19T21:01:47.000Z,"Today, we celebrate #Juneteenth for the first time as an official federal holiday. 

It serves as a meaningful reminder of our responsibility to fully confront our history and dismantle systemic inequality in our country. 

📸: @iamJuneteenth https://t.co/GeyM6EEYLt",",",",Juneteenth,",",iamJuneteenth,",",https://t.co/GeyM6EEYLt,"
1211,John Hickenlooper,SenatorHick,2021-06-21T00:38:44.000Z,Trans rights are civil rights are human rights.,",",",",",",","
1212,John Hickenlooper,SenatorHick,2021-06-20T21:18:24.000Z,"Happy Pride, Colorado! Thank you @BriannaForCO for joining us at drag brunch today to talk about the Equality Act! https://t.co/J5w8kQicmz",",",",",",BriannaForCO,",",https://t.co/J5w8kQicmz,"
1213,John Hickenlooper,SenatorHick,2021-06-20T19:02:55.000Z,"When we stand with refugees our country becomes a more inclusive, multicultural, and interconnected place. #WorldRefugeeDay https://t.co/F16Cdby94i",",",",WorldRefugeeDay,",",",",https://t.co/F16Cdby94i,"
1214,John Hickenlooper,SenatorHick,2021-06-20T14:41:07.000Z,Happy #FathersDay to any man raising a child or acting as a role model for one. Being Teddy's dad will always be my proudest accomplishment and greatest joy. https://t.co/Cfz5IafEL7,",",",FathersDay,",",",",https://t.co/Cfz5IafEL7,"
1215,John Hickenlooper,SenatorHick,2021-06-19T20:34:52.000Z,Honored to join the Juneteenth Parade in Denver today. https://t.co/vsYpBKxinj,",",",",",",",https://t.co/vsYpBKxinj,"
1216,John Hickenlooper,SenatorHick,2021-06-19T14:06:59.000Z,"Today, on #Juneteenth, we recognize the oldest known celebration honoring the end of slavery in the United States. It’s also a reminder that our country is still reckoning with structural racism that continues to plague our health, justice, and economic systems.",",",",Juneteenth,",",",","
1217,Richard Blumenthal,SenBlumenthal,2021-06-20T22:21:01.000Z,"At the Branford Road Race, thousands celebrating Father’s Day in this spectacular annual run—back this year after a break because of COVID. Thanks &amp; congrats to all. https://t.co/hbloM3aGh6",",",",",",",",https://t.co/hbloM3aGh6,"
1218,Richard Blumenthal,SenBlumenthal,2021-06-20T21:02:32.000Z,"Wishing all dads &amp; father figures a very Happy Father’s Day. We are deeply grateful for your dedication, encouragement, &amp; love.",",",",",",",","
1219,Richard Blumenthal,SenBlumenthal,2021-06-20T00:50:49.000Z,"Joyous, proud Juneteenth parades &amp; celebrations in Bridgeport, Easton, &amp; Milford. I was so inspired by great people &amp; spirit. https://t.co/NnnuEu0r4A",",",",",",",",https://t.co/NnnuEu0r4A,"
1220,Richard Blumenthal,SenBlumenthal,2021-06-19T18:08:07.000Z,"CDC may accommodate a dangerous politically driven court decision by rewriting some details, but must retain key safety protections. Vaccinations are vital. So are COVID tests &amp; other steps. Cruise ships may again become deadly Petri dishes of disease without them.",",",",",",",","
1221,Richard Blumenthal,SenBlumenthal,2021-06-19T18:08:07.000Z,A single wrongheaded court decision shouldn’t trump common sense. Consumers ought to think twice before sailing on any cruise ship failing to follow CDC safety rules—like requiring vaccinations for passengers &amp; crew.,",",",",",",","
1222,Richard Blumenthal,SenBlumenthal,2021-06-19T18:08:06.000Z,"If ships sail unsafely, cruise lines will be responsible for COVID-19 casualties, despite this misguided, misleading court decision. Vaccinations, testing, medical facilities on board, &amp; more are the minimal measures of a morally &amp; legally mandated standard of care. https://t.co/PFq1zpl2Fj",",",",",",",",https://t.co/PFq1zpl2Fj,"
1223,Richard Blumenthal,SenBlumenthal,2021-06-19T16:55:50.000Z,"#Juneteenth is not only a commemoration, but a call to action. Our country has come a long way, but the past year has shown us just how much work remains unfinished. It’s on all of us to continue the fight for racial justice &amp; equity.",",",",Juneteenth,",",",","
1224,Chris Murphy,ChrisMurphyCT,2021-06-20T02:23:41.000Z,C’mon everyone. https://t.co/r4EAle6tIY,",",",",",",",https://t.co/r4EAle6tIY,"
1225,Chris Murphy,ChrisMurphyCT,2021-06-20T02:01:32.000Z,"RT @ossoff: Since yesterday we’ve raised $48,300 to support @ReverendWarnock’s re-election.

Can we hit $60k by tonight?

✅ Support year-ro…",",ossoff,",",",",",","
1226,Chris Murphy,ChrisMurphyCT,2021-06-19T22:41:11.000Z,Thanks to Jim Smith for showing me around Cushman Farm in Franklin yesterday. We talked a lot about federal support for soil improvement programs. Thanks also to @bryanhurlburt @CathyOsten and Rep. Kevin Ryan and First Selectman Charles Grant for joining. https://t.co/kBm23329fJ,",",",",",bryanhurlburt,CathyOsten,",",https://t.co/kBm23329fJ,"
1227,Chris Murphy,ChrisMurphyCT,2021-06-19T19:13:58.000Z,RT @nycsouthpaw: pls find my comments attached thx https://t.co/6mzOtHN6Oz,",nycsouthpaw,",",",",",","
1228,Chris Murphy,ChrisMurphyCT,2021-06-19T15:13:52.000Z,YMCA Camp Hazen in Chester has opened their doors to more kids in need this summer thanks to funds from the American Rescue Plan. I went there Friday to say thanks to the amazing staff. https://t.co/I65rCP27UO,",",",",",",",https://t.co/I65rCP27UO,"
1229,Tom Carper,SenatorCarper,2021-06-20T19:31:53.000Z,"Being a father to my amazing sons is one of the greatest joys of my life. Happy Father’s Day to dads up and down Delaware, and across the country. https://t.co/FO3omc2LUS",",",",",",",",https://t.co/FO3omc2LUS,"
1230,Tom Carper,SenatorCarper,2021-06-19T21:59:41.000Z,RT @RepLBR: I was honored to help kick off the Wilmington Library’s Juneteenth Festival as we celebrate it as a national holiday for the fi…,",RepLBR,",",",",",","
1231,Tom Carper,SenatorCarper,2021-06-19T19:06:35.000Z,"Today also makes us reckon with our nation’s history, and reminds us that our work to form a more perfect union is far from over. As we celebrate and reflect on the progress we have made, we must also recommit our efforts to move toward equality and justice for all.",",",",",",",","
1232,Tom Carper,SenatorCarper,2021-06-19T19:06:34.000Z,"Juneteenth is a day to commemorate the emancipation of African Americans who had been enslaved in the United States. 

It was an honor to join with community and business leaders in Wilmington and Middletown today to celebrate this newly installed federal holiday. https://t.co/XOhSkwenPJ",",",",",",",",https://t.co/XOhSkwenPJ,"
1233,Tom Carper,SenatorCarper,2021-06-19T17:25:37.000Z,RT @EPWCmte: Today we celebrate #JuneTeenth and reflect on the work ahead us to create a more perfect union. We aren’t all truly free until…,",EPWCmte,",",",",",","
1234,Chris Coons,ChrisCoons,2021-06-20T18:31:46.000Z,"On #WorldRefugeeDay, we recommit to that long tradition, stand with the most vulnerable among us, and work toward once again meeting robust refugee admissions goals.",",",",WorldRefugeeDay,",",",","
1235,Chris Coons,ChrisCoons,2021-06-20T18:31:46.000Z,The United States has a long tradition of welcoming and resettling refugees. Those fleeing violence and conflict from countries around the world have become a valuable part of the fabric of American society.,",",",",",",","
1236,Chris Coons,ChrisCoons,2021-06-19T14:23:41.000Z,"The end of the darkest period in our nation’s history is a cause for celebration and pride, and today offers us an important opportunity to reflect on the meaning of equality in the United States. So let us pause and recommit ourselves to knowing our #juneteenth history. https://t.co/q6M5x1Z8MT",",",",juneteenth,",",",",https://t.co/q6M5x1Z8MT,"
1237,Marco Rubio,marcorubio,2021-06-20T12:28:42.000Z,"Every major social problem in America can be linked to fatherlessness

Wherever involved fathers are rare,crisis is certain to follow 

And billions in government spending is no substitute for fatherhood",",",",",",",","
1238,Marco Rubio,marcorubio,2021-06-20T12:04:41.000Z,"“Where were you when I founded the earth?”

Job 38:4",",",",",",",","
1239,Marco Rubio,marcorubio,2021-06-19T12:56:30.000Z,"Marxism divides people into either oppressors or victims, calls for the overthrow an “evil” system &amp; then seizes complete power in the name of “fairness” 

The old Marxism used class warfare to divide people

The new Marxism uses identity politics 

But the goal is the same",",",",",",",","
1240,Marco Rubio,marcorubio,2021-06-19T12:22:01.000Z,"The angel of the LORD encamps around those who fear him, and he saves them.

Psalms 34:8",",",",",",",","
1241,Rick Scott,SenRickScott,2021-06-20T21:30:22.000Z,"This week, the Senate passed my resolution with @marcorubio congratulating the @GatorsMTN for winning the 2021 NCAA Tennis Championship. We’re proud of the team’s hard work and for representing Florida well on the court! 🐊🎾",",",",",",marcorubio,GatorsMTN,",","
1242,Rick Scott,SenRickScott,2021-06-20T19:46:16.000Z,Being a father and grandfather is the greatest joy of my life. I wouldn't be who I am today without the unconditional love of my adoptive father &amp; the lessons he taught me about the value of hard work &amp; determination. I wish every dad &amp; grandpa a wonderful #FathersDay! https://t.co/mIxmGNtwpI,",",",FathersDay,",",",",https://t.co/mIxmGNtwpI,"
1243,Rick Scott,SenRickScott,2021-06-20T17:31:32.000Z,"Across our state, Florida’s law enforcement officers are working every day to make our communities safer and better places to live.

I commend these @PascoSheriff deputies for their kindness and generosity. Thank you for all you do for Florida families. https://t.co/WNU3uLpsWJ",",",",",",PascoSheriff,",",https://t.co/WNU3uLpsWJ,"
1244,Rick Scott,SenRickScott,2021-06-19T23:00:48.000Z,The United States cannot back down when it comes to holding Communist China accountable for its genocide against the Uyghurs. We must unapologetically lead the world in this effort. Biden’s @StateDept should address this report immediately. https://t.co/EgpONTqJMY,",",",",",StateDept,",",https://t.co/EgpONTqJMY,"
1245,Rick Scott,SenRickScott,2021-06-19T21:23:01.000Z,"Why are New Yorkers fleeing to Florida in droves?

In New York…
High Taxes❌
High Crime ❌
Burdensome Govt Overreach ❌

In Florida…
Low Taxes ✅
Safe Communities ✅
Freedom from Bureaucracy ✅
Sunshine State Weather ☀️ 🏖 https://t.co/PuTgoXpo7H",",",",",",",",https://t.co/PuTgoXpo7H,"
1246,Rick Scott,SenRickScott,2021-06-19T19:27:20.000Z,ICYMI: El aumento de la inflación debido al gasto imprudente del gobierno está subiendo todos los precios. Ayer me reuní con dueños de pequeños negocios para hablar de la crisis inflacionaria de Biden y mis acciones para proteger a los floridanos de la ola de gastos de Washington,",",",",",",","
