,Name,Twitter Handle,Time,Content,Retweeting,Hashtags,Tagged,Links
353,Carolyn Bourdeaux,RepBourdeaux,2021-06-19T15:43:38.000Z,"110 years ago, Charlie Hale was lynched in Lawrenceville’s town square. He never got justice, but today we remember him — and the consequences of hate. I was honored to join today’s service to memorialize this spot in his name. https://t.co/YPl3M2aD6z",",",",",",",",https://t.co/YPl3M2aD6z,"
354,Carolyn Bourdeaux,RepBourdeaux,2021-06-19T12:56:00.000Z,"Two and a half years. That’s how long it took for the last enslaved people in the country to hear they were free. 
Today, #Juneteenth, I join in celebrating their liberation. https://t.co/jzgz1pHYGG",",",",Juneteenth,",",",",https://t.co/jzgz1pHYGG,"
355,Austin Scott,AustinScottGA08,2021-06-20T15:25:25.000Z,I’d like to extend a very special “Happy Father’s Day” to all our Eighth District dads. #GA08 #FathersDay https://t.co/lm6zVxIAY7,",",",GA08,FathersDay,",",",",https://t.co/lm6zVxIAY7,"
356,Austin Scott,AustinScottGA08,2021-06-19T15:45:08.000Z,"On June 19, 1865, Union soldiers landed at Galveston, TX with news that the Civil War had ended &amp; enslaved people were now free. This was two &amp; a half years after the Emancipation Proclamation. Today, we recognize #Juneteenth - celebrating freedom &amp; the end of slavery in America. https://t.co/MN5XCK6lmO",",",",Juneteenth,",",",",https://t.co/MN5XCK6lmO,"
357,Andrew Clyde,Rep_Clyde,2021-06-21T01:00:00.000Z,#WhereistheCzar #HidinHarris https://t.co/1EUvvcpB44,",",",WhereistheCzar,HidinHarris,",",",",https://t.co/1EUvvcpB44,"
358,Andrew Clyde,Rep_Clyde,2021-06-20T17:34:56.000Z,"Happy Father's Day to all the incredible fathers, grandfathers, and father figures in #GA09! Thank you for all the wisdom you give to those with whom you come in contact. Today we celebrate you! https://t.co/B48TseeuDm",",",",GA09,",",",",https://t.co/B48TseeuDm,"
359,Andrew Clyde,Rep_Clyde,2021-06-19T13:00:00.000Z,#WhereistheCzar #HidinHarris https://t.co/WMtTEiEtCo,",",",WhereistheCzar,HidinHarris,",",",",https://t.co/WMtTEiEtCo,"
360,Jody Hice,congressmanhice,2021-06-20T22:05:43.000Z,"This is EXACTLY what I was talking about with Director Wray during the ⁦@GOPoversight⁩ hearing.

ICYMI, here’s the full clip 👉 https://t.co/9Wvlo1QMpZ https://t.co/1I4O4qBHfP",",",",",",GOPoversight,",",https://t.co/9Wvlo1QMpZ,https://t.co/1I4O4qBHfP,"
361,Jody Hice,congressmanhice,2021-06-20T20:13:45.000Z,"RT @DineshDSouza: How come Jan 6 rioters are held in solitary confinement, while BLM and Antifa burn our cities down with impunity? @JodyHi…",",DineshDSouza,",",",",",","
362,Jody Hice,congressmanhice,2021-06-20T20:13:34.000Z,I want to wish all fathers and father figures a very happy Father's Day! My own father was instrumental in making me the man I am today and I am forever grateful for him. https://t.co/ErL4rTtG0a,",",",",",",",https://t.co/ErL4rTtG0a,"
363,Jody Hice,congressmanhice,2021-06-19T15:20:17.000Z,"#Juneteenth21 is an opportunity for us to reflect on the tremendous progress by America in making a reality the principle ""all men are created equal!""

Enjoy this new federal holiday with your loved ones!",",",",Juneteenth21,",",",","
364,Barry Loudermilk,RepLoudermilk,2021-06-20T11:30:10.000Z,https://t.co/a4CUoEpagV,",",",",",",",https://t.co/a4CUoEpagV,"
365,Rick W. Allen,reprickallen,2021-06-20T12:48:41.000Z,Being a father and grandfather is one of the greatest joys in my life. Happy Father’s Day to all the dads in #GA12! https://t.co/FLzDg2ZIvy,",",",GA12,",",",",https://t.co/FLzDg2ZIvy,"
366,David Scott,RepDavidScott,2021-06-20T15:07:28.000Z,The gift of fatherhood has been one of my life’s greatest joys. Wishing all the dads out there a Happy #FathersDay from my family to yours! https://t.co/vvykVaQXbk,",",",FathersDay,",",",",https://t.co/vvykVaQXbk,"
367,David Scott,RepDavidScott,2021-06-19T14:57:06.000Z,"As we celebrate the first #Juneteenth recognized as a federal holiday, let us honor the late Reverend Dr. Martin Luther King, Jr.’s challenge to, “Let freedom ring!” across our nation and continue to march forward together in a new era of freedom, justice and unity. https://t.co/KQlrfK4z9T",",",",Juneteenth,",",",",https://t.co/KQlrfK4z9T,"
368,Marjorie Taylor Greene,RepMTG,2021-06-19T13:15:54.000Z,"Over 7.4 million people viewed our #FireFauci press conference this week on Fox News FB page.

Thank you ...

@RepThomasMassie 
@RepMaryMiller 
@RepAndyBiggsAZ 
@RepGosar 
@RepMoBrooks
@RepBuddyCarter
@RepBobGood 

Watch Here -&gt;

https://t.co/ANnC3SgJXx https://t.co/Qnf1XANHxr",",",",FireFauci,",",RepThomasMassie,RepMaryMiller,RepAndyBiggsAZ,RepGosar,RepMoBrooks,RepBuddyCarter,RepBobGood,",",https://t.co/ANnC3SgJXx,https://t.co/Qnf1XANHxr,"
369,Ed Case,RepEdCase,2021-06-20T03:31:08.000Z,2/2 w/some of my faves that got me into a lifetime of reading.,",",",",",",","
370,Ed Case,RepEdCase,2021-06-20T03:31:08.000Z,"1/2 As the son of a children's librarian, really enjoyed joining State Librarian Stacey Aldrich and her Hawaii State Public Library System team at preview of reopening of beautifully renovated historic Liliha Public Library, complete w/memory lane trip... https://t.co/Bf46mWQX6a",",",",",",",",https://t.co/Bf46mWQX6a,"
371,Kai Kahele,RepKahele,2021-06-20T23:41:26.000Z,"Aloha Lā Makuakane! 

Happy Father’s Day!

‘Ohana is everything. Excited to bring some reinforcements back with me to Washington. DC is not ready! https://t.co/tkCjfTvnCk",",",",",",",",https://t.co/tkCjfTvnCk,"
372,Kai Kahele,RepKahele,2021-06-20T20:29:05.000Z,"It’s been another successful week representing #HI02 in Congress. 

Check out my week in review and be sure to sign up for my newsletter at https://t.co/b9URQrWduc https://t.co/qJUud2kEQV",",",",HI02,",",",",https://t.co/b9URQrWduc,https://t.co/qJUud2kEQV,"
373,Russ Fulcher,RepRussFulcher,2021-06-19T15:28:57.000Z,The Child Interstate Abortion Notification Act makes it a crime to knowingly transport a minor across state lines to obtain an abortion without satisfying parental involvement law in the minor’s state of residence. I’ve cosponsored this bill: https://t.co/z1ZRX4t139 https://t.co/8ns7XUPcuV,",",",",",",",https://t.co/z1ZRX4t139,https://t.co/8ns7XUPcuV,"
374,Mike Simpson,CongMikeSimpson,2021-06-19T15:31:43.000Z,Welcome to the Gem State https://t.co/mOsC6UiXuz,",",",",",",",https://t.co/mOsC6UiXuz,"
375,Bobby Rush,RepBobbyRush,2021-06-20T15:28:08.000Z,"Wishing a very happy #FathersDay to all the dads and father figures in the 1st District and across the country! Today, we honor and appreciate all that you sacrifice, teach, and contribute to your families and communities.",",",",FathersDay,",",",","
376,Bobby Rush,RepBobbyRush,2021-06-19T14:20:41.000Z,"#Juneteenth is not only a celebration of freedom, but a chance to reflect on HOW America was built and the immense pain and suffering that millions of enslaved Black men and women endured.

Acknowledging our history informs and advances our fight for racial justice today.",",",",Juneteenth,",",",","
377,Robin Kelly,RepRobinKelly,2021-06-20T14:01:00.000Z,"Happy #FathersDay to all our devoted Dads who have the hardest, most important job in the world—molding little human beings into caring, loving, principled adults who will make this world a better place than what we left it.",",",",FathersDay,",",",","
378,Marie Newman,RepMarieNewman,2021-06-20T21:48:01.000Z,"Yesterday, my office hosted the first ever #IL03 job fest! 

It was great to connect folks looking for work with hiring businesses across the district. 

Thanks for coming out! 👋 https://t.co/yyTNRmf8Hk",",",",IL03,",",",",https://t.co/yyTNRmf8Hk,"
379,Marie Newman,RepMarieNewman,2021-06-20T14:11:52.000Z,"Happy #FathersDay to all the fathers and father-figures that make our lives easier every single day. 

Thank you for all you do. ❤️ https://t.co/qf3yZwXmah",",",",FathersDay,",",",",https://t.co/qf3yZwXmah,"
380,Marie Newman,RepMarieNewman,2021-06-19T15:02:55.000Z,"🚨In ONE HOUR, we kick off our first-ever IL-03 Jobs Fest to connect hiring businesses with residents looking for work! 

There are more than 15 different local businesses ready to hear from job seekers! 

See you there! https://t.co/OQEiGxFuq8",",",",",",",",https://t.co/OQEiGxFuq8,"
381,Marie Newman,RepMarieNewman,2021-06-19T14:30:05.000Z,"Two and a half years after the Emancipation Proclamation, Major General Granger arrived in Texas on June 19th to announce the end of slavery in the United States.

Honoring #Juneteenth is just one small step in our long continued fight for equality and justice for all.",",",",Juneteenth,",",",","
382,Marie Newman,RepMarieNewman,2021-06-19T14:26:17.000Z,RT @SBACIL: We are thrilled to support the REST Act. Thank you to @RepMarieNewman and staff for fighting for #smallbusiness !,",SBACIL,",",",",",","
383,Jesús García,RepChuyGarcia,2021-06-20T16:50:11.000Z,"After a year of social distancing, we can now get vaccinated and hug our fathers and father figures a little harder today! 
 
#FathersDay https://t.co/pqNsDlpyvh",",",",FathersDay,",",",",https://t.co/pqNsDlpyvh,"
384,Jesús García,RepChuyGarcia,2021-06-19T18:50:53.000Z,"RT @staceyabrams: This #Juneteenth, we celebrate the emancipation of Black Americans &amp; reflect on their activism pushing our nation towards…",",staceyabrams,",",",",",","
385,Mike Quigley,RepMikeQuigley,2021-06-20T14:05:00.000Z,"Happy Father's Day! 

Being a father is one of the greatest joys of my life, and today I am reminded of how lucky I am. #FathersDay",",",",FathersDay,",",",","
386,Mike Quigley,RepMikeQuigley,2021-06-19T15:46:00.000Z,"Happy Juneteenth!

I'm proud to have been a part of the historic vote to make this day a federal holiday, and glad Congress was able to come together to pass the bill.",",",",",",",","
387,Sean Casten,RepCasten,2021-06-20T18:56:20.000Z,"Happy #FathersDay to all the dads, grandpas, step-dads, &amp; father-figures who work every day to leave a better planet behind for their children. https://t.co/RedPC177ep",",",",FathersDay,",",",",https://t.co/RedPC177ep,"
388,Sean Casten,RepCasten,2021-06-19T20:55:46.000Z,"By requiring publicly traded companies to disclose climate-related risks, my bill will harness the power of free markets to ensure investors are empowered to make smarter decisions as we transition to cleaner, cheaper energy. It’s a win, win, win.",",",",",",",","
389,Sean Casten,RepCasten,2021-06-19T20:55:46.000Z,"Passing common-sense, market-based solutions to safeguard our financial system against climate change has been a top priority since my first day in Congress—and I was so glad to see the House pass my Climate Risk Disclosure Act this week.",",",",",",",","
390,Sean Casten,RepCasten,2021-06-19T16:30:00.000Z,"If we want to prevent a financial crisis and economic catastrophe, then we need #ClimateAction, NOW. I joined @ASP to discuss how my Climate Risk Disclosure Act protects investors, our planet, and our financial security. https://t.co/l1PP6XlrrS",",",",ClimateAction,",",ASP,",",https://t.co/l1PP6XlrrS,"
391,Sean Casten,RepCasten,2021-06-19T15:47:12.000Z,"RT @ASP: This week on ASP: Rep. @jahimes &amp; @RepChrisStewart discuss United States-Russia relations, @RepCasten on the Climate Risk Disclosu…",",ASP,",",",",",","
392,Sean Casten,RepCasten,2021-06-19T14:13:00.000Z,"This #Juneteenth, we remember those who paid the ultimate price fighting for their freedom. Today we continue to fight for every person’s right to life, liberty &amp; the pursuit of happiness.

https://t.co/L9iNVXH0JR",",",",Juneteenth,",",",",https://t.co/L9iNVXH0JR,"
393,Danny K. Davis,RepDannyDavis,2021-06-20T22:55:08.000Z,Enjoy the BIG piece of chicken today gentlemen. https://t.co/TkP669kViB,",",",",",",",https://t.co/TkP669kViB,"
394,Danny K. Davis,RepDannyDavis,2021-06-20T15:55:10.000Z,RT @Mycrazy64212091: Check this out🙌🏽🙌🏽.  He’s running against Sarah Huckabee Sanders👍👍👍,",Mycrazy64212091,",",",",",","
395,Raja Krishnamoorthi,congressmanraja,2021-06-20T23:25:02.000Z,"Way to go Illinois! As we go on to one week of reopening, I want to remind everyone the fight isn't over yet. Highly contagious variants could backtrack our progress, but vaccines can help! If you haven't been vaccinated yet, there's no time like today. 
https://t.co/tPNEvCjy5j",",",",",",",",https://t.co/tPNEvCjy5j,"
396,Raja Krishnamoorthi,congressmanraja,2021-06-20T21:25:02.000Z,"In Illinois, 64 cases of the #COVID19 Delta variant – which is more transmissible – have been diagnosed. 
This is why my NOVID Act is needed for the United States. It seems counterintuitive, but if we vaccinate other countries, we protect ourselves.
https://t.co/I0a1xikt4Y",",",",COVID19,",",",",https://t.co/I0a1xikt4Y,"
397,Raja Krishnamoorthi,congressmanraja,2021-06-20T18:45:03.000Z,"“For weeks, President Donald Trump and his allies had been pressing them to use federal law enforcement’s muscle to back his unfounded claims of voter fraud and a stolen election.”
President Trump used the Justice Department as his personal law firm.
https://t.co/lMEMFOyp0A",",",",",",",",https://t.co/lMEMFOyp0A,"
398,Raja Krishnamoorthi,congressmanraja,2021-06-20T14:40:06.000Z,Happy Father’s Day! Take time today to thank the men in your life who have served as role models. https://t.co/2GQL351GBG,",",",",",",",https://t.co/2GQL351GBG,"
399,Raja Krishnamoorthi,congressmanraja,2021-06-20T11:25:01.000Z,"Achievement gaps between low-income and diverse students must be addressed in this state. I am glad to see a plan to reverse this trend and keep all of our students in Illinois on track!
https://t.co/l8ScjQpDra",",",",",",",",https://t.co/l8ScjQpDra,"
400,Raja Krishnamoorthi,congressmanraja,2021-06-19T23:05:02.000Z,"Higher vaccination rates = fewer #COVID19 cases
Lower vaccination rates = rising #COVID19 cases
https://t.co/PKPI1eBp2E",",",",COVID19,COVID19,",",",",https://t.co/PKPI1eBp2E,"
401,Raja Krishnamoorthi,congressmanraja,2021-06-19T20:10:03.000Z,"The Director of Public Citizen’s Access to Medicines Program recognizes how the NOVID Act will save countless lives, trillions of dollars, and support the U.S.' global presence. That's a win-win-win. https://t.co/0SbBB5KGQp",",",",",",",",https://t.co/0SbBB5KGQp,"
402,Raja Krishnamoorthi,congressmanraja,2021-06-19T18:10:02.000Z,"I’m proud of my state – Illinois – for making Juneteenth an official state holiday. 
https://t.co/yI7NixOQPA",",",",",",",",https://t.co/yI7NixOQPA,"
403,Raja Krishnamoorthi,congressmanraja,2021-06-19T14:40:04.000Z,"This Juneteenth, we acknowledge our country's history and are reminded of the fight for equality that we are continuing. #Juneteenth #FreedomDay https://t.co/H2YxLU7G6b",",",",Juneteenth,FreedomDay,",",",",https://t.co/H2YxLU7G6b,"
404,Raja Krishnamoorthi,congressmanraja,2021-06-19T12:25:02.000Z,"Its official, Juneteenth will now be acknowledged as an official federal holiday! This will ensure that children grow up knowing our nation’s history and will allow us to celebrate the freedom our country truly stands for. 
https://t.co/dSEAtPnJwh",",",",",",",",https://t.co/dSEAtPnJwh,"
405,Raja Krishnamoorthi,congressmanraja,2021-06-19T11:35:02.000Z,"The FDA issued guidance on safely using flea &amp; tick products for pets. I’m currently investigating Seresto flea &amp; tick collar after reports of pet injury and death from their product. I will push the FDA for more of a response than this safety guidance.
https://t.co/IvQdNe8jCK",",",",",",",",https://t.co/IvQdNe8jCK,"
406,Bill Foster,RepBillFoster,2021-06-20T14:50:47.000Z,"There is nothing like having a father figure in your life. 
 
Today, we honor the fathers who continue to uplift our communities. #FathersDay https://t.co/9EGtiAgqZu",",",",FathersDay,",",",",https://t.co/9EGtiAgqZu,"
407,Bill Foster,RepBillFoster,2021-06-19T14:13:24.000Z,".#Juneteenth is a day that uplifts the voices of one of the most marginalized groups in American history.

We are working tirelessly to get the #ForThePeopleAct passed in Congress so that black &amp; brown communities’ right to vote &amp; be heard is honored across the country. https://t.co/fJEkQXz7BO",",",",Juneteenth,ForThePeopleAct,",",",",https://t.co/fJEkQXz7BO,"
408,Mike Bost,RepBost,2021-06-20T15:09:05.000Z,"Happy Father's Day to all of the dads out there! I've had many job titles in my life, but the best by far are dad and Papa Mike. And I've been blessed with the best role model and teacher there is, my dad, Gene Bost. Love you Dad! https://t.co/kWrHHyOD44",",",",",",",",https://t.co/kWrHHyOD44,"
409,Mike Bost,RepBost,2021-06-19T16:57:56.000Z,"This week, President Biden signed a new law designating Juneteenth a federal holiday, the first new federal holiday since MLK Jr. Day was established in 1983.",",",",",",",","
410,Mike Bost,RepBost,2021-06-19T16:57:56.000Z,"President Lincoln issued the Emancipation Proclamation on September 22, 1862, but slavery in some parts of the confederacy did not end until over 2 yrs later. On June 19, 1865, Major General Gordon Granger arrived in Galveston, Texas w/ the announcement that all slaves were free. https://t.co/v8sNn69ezB",",",",",",",",https://t.co/v8sNn69ezB,"
411,Rodney Davis,RodneyDavis,2021-06-20T19:40:43.000Z,It was great to celebrate Father’s Day with my dad Marty.  Griffin &amp; Clark and the rest of our local family made our day special.  We missed Toryn today but will see her soon.  Happy Father’s Day to all the dads out there! https://t.co/N2i5QuD7qP,",",",",",",",https://t.co/N2i5QuD7qP,"
412,Rodney Davis,RodneyDavis,2021-06-19T14:38:11.000Z,"#Juneteenth, now a federal holiday, is a celebration of emancipation and the end of slavery in the United States. Juneteenth is the day we began to live up to our founding principle that all men are created equal. You can learn more about its history here: https://t.co/Euch58cjkD https://t.co/oHyfALUbTy",",",",Juneteenth,",",",",https://t.co/Euch58cjkD,https://t.co/oHyfALUbTy,"
413,Lauren Underwood,LaurenUnderwood,2021-06-20T15:42:24.000Z,Happy Father's Day to all the fatherly figures out there -- but especially to my dad! https://t.co/ojCKoAR7e6,",",",",",",",https://t.co/ojCKoAR7e6,"
414,Mary Miller,RepMaryMiller,2021-06-19T23:26:10.000Z,This is heartbreaking! https://t.co/lsroZbYDPF,",",",",",",",https://t.co/lsroZbYDPF,"
415,Cheri Bustos,RepCheri,2021-06-20T13:51:37.000Z,"When I first got into reporting, my Dad shared his own life lessons and advice to help me become better.

Over the years, I learned a lot from my Dad. Today, my heart is with all the Dads out there. #HappyFathersDay to all the Dads I know, including my husband Gerry and my sons. https://t.co/qwi2DaeQmY",",",",HappyFathersDay,",",",",https://t.co/qwi2DaeQmY,"
416,Cheri Bustos,RepCheri,2021-06-19T14:54:00.000Z,"This #Juneteenth we commemorate the end of slavery in America and the significance of this moment in our nation’s long journey toward freedom &amp; justice for all.
 
We still travel this road today as we work to expand access to the ballot, affordable health care &amp; a good education. https://t.co/WVLmmYnZ8M",",",",Juneteenth,",",",",https://t.co/WVLmmYnZ8M,"
417,Darin LaHod,RepLaHood,2021-06-20T14:54:43.000Z,"There is no greater joy in life than being McKay, Lucas, and Teddy’s Dad. Today, I am thankful for my own Dad and my three sons. Happy Father’s Day, everyone! https://t.co/coXkxcPdJk",",",",",",",",https://t.co/coXkxcPdJk,"
418,Darin LaHod,RepLaHood,2021-06-19T16:12:45.000Z,It was a pleasure to present Anthony Joseph with an American flag to congratulate him on becoming an Eagle Scout. Attaining the rank of Eagle Scout takes an incredible amount of dedication and our community is lucky to have young leaders like Anthony. https://t.co/Um3gzHt7m8,",",",",",",",https://t.co/Um3gzHt7m8,"
419,Darin LaHod,RepLaHood,2021-06-19T14:12:52.000Z,"Juneteenth is an opportunity to recognize the struggles we have gone through as a country, the heights we have attained, and that we are always striving together toward that beautiful vision of a nation where all men are created equal. https://t.co/goUQf53h1D",",",",",",",",https://t.co/goUQf53h1D,"
420,Darin LaHod,RepLaHood,2021-06-19T14:12:50.000Z,"I joined the Tazewell County community to celebrate Juneteenth at Woodrow Cemetery, where Coordinators of the Underground Railroad are buried. Juneteenth commemorates the end of slavery in Galveston, TX in 1865, and today, we celebrate that pivotal moment in our nation’s history. https://t.co/TM8tjqPyww",",",",",",",",https://t.co/TM8tjqPyww,"
421,Darin LaHod,RepLaHood,2021-06-19T13:22:47.000Z,"I am proud to be named as a recipient of the @USChamber's Abraham Lincoln Leadership for America Award. In Congress, I will continue to seek common ground on policies that strengthen our communities in central and west-central Illinois. https://t.co/TcENwTTJ0d",",",",",",USChambers,",",https://t.co/TcENwTTJ0d,"
422,Frank J. Mrvan,RepMrvan,2021-06-20T15:14:08.000Z,Happy #FathersDay Northwest Indiana! https://t.co/5BE3vWHYiT,",",",FathersDay,",",",",https://t.co/5BE3vWHYiT,"
423,Frank J. Mrvan,RepMrvan,2021-06-19T12:21:31.000Z,"Honored to have been able to vote this week for legislation that established #Juneteenth as a federal holiday.  Let us continue the work that needs to be done to recognize every person’s constitutional right to life, liberty, and the pursuit of happiness. https://t.co/jqshjSmq2S",",",",Juneteenth,",",",",https://t.co/jqshjSmq2S,"
424,Jackie Walorski,RepWalorski,2021-06-19T12:42:00.000Z,Juneteenth is a celebration of freedom and opportunity. As we mark a pivotal moment in our nation’s history – the emancipation of the last enslaved Americans after the Civil War – we continue our work to fulfill the promise of liberty and justice for all.,",",",",",",","
425,Jim Banks,RepJimBanks,2021-06-20T23:37:33.000Z,RT @joshrogin: .@jonathanvswan nails @ImranKhanPTI on his hypocrisy of loudly criticizing the West for how it treats Muslims while refusing…,",joshrogin,",",",",",","
426,Jim Banks,RepJimBanks,2021-06-19T16:40:52.000Z,"RT @ElbridgeColby: Republican voter priorities for foreign policy: 
1) ⏬ illegal immigration
2) Protect US jobs
3) Take on China
4) Protect…",",ElbridgeColby,",",",",",","
427,Jim Banks,RepJimBanks,2021-06-19T16:36:31.000Z,"Dogs are the family you get to choose. 

My heart and prayers go out to the Biden family during this time of grief. https://t.co/KRGbE6sUpD",",",",",",",",https://t.co/KRGbE6sUpD,"
428,Jim Banks,RepJimBanks,2021-06-19T16:28:33.000Z,"RT @SenRickScott: There are many issues with the Senate's $250 BILLION ""China bill,"" but its total lack of pro-life protections is somethin…",",SenRickScott,",",",",",","
429,Jim Banks,RepJimBanks,2021-06-19T15:36:24.000Z,"🚀🚀🚀 @JoeBiden
https://t.co/cJ7uNoFoRb",",",",",",JoeBiden,",",https://t.co/cJ7uNoFoRb,"
430,Jim Banks,RepJimBanks,2021-06-19T13:54:45.000Z,Great to join @IngrahamAngle last night and discuss why extremist beliefs like Critical Race Theory have no place in our military. Watch it 👇 https://t.co/agOGWHsAQo,",",",",",IngrahamAngle,",",https://t.co/agOGWHsAQo,"
431,Jim Baird,RepJimBaird,2021-06-20T13:03:00.000Z,"Being a dad is the best job I’ve ever had. Fathers have an important responsibility to guide, teach, and serve as a role model for their children. Happy Father’s Day everyone! https://t.co/nIBRcYydFc",",",",",",",",https://t.co/nIBRcYydFc,"
432,Victoria Spartz,RepSpartz,2021-06-21T01:20:16.000Z,My warmest wishes to all fathers! https://t.co/BjUjC7WbV0,",",",",",",",https://t.co/BjUjC7WbV0,"
433,Victoria Spartz,RepSpartz,2021-06-19T19:31:08.000Z,"This poll is consistent with our recent BigTech district survey: 76% supporting, 9% undecided, &amp; only 15% opposing any legislative action. Congress needs to deliberate on the best solutions to address excessive #BigTech powers &amp; protect people’s rights. https://t.co/KLGkKukVf3",",",",BigTech,",",",",https://t.co/KLGkKukVf3,"
434,Victoria Spartz,RepSpartz,2021-06-19T14:13:45.000Z,What an amazing accomplishment! Congratulations to Carmel's own Drew Kibler &amp; Jake Mitchell on this huge achievement. Best of luck as you represent @CarmelSwimming and Indiana in the #Olympics2021! https://t.co/kv5TACqOd1,",",",Olympics2021,",",CarmelSwimming,",",https://t.co/kv5TACqOd1,"
435,Victoria Spartz,RepSpartz,2021-06-19T14:10:58.000Z,RT @HouseGOP: https://t.co/iKk7MNAU88,",HouseGOP,",",",",",","
436,Greg Pence,RepGregPence,2021-06-20T21:10:50.000Z,"RT @Mike_Pence: Remembering my Dad on this Father’s Day. Ed Pence was a man of faith, a Korean War Veteran, a small businessman and the Bes…",",Mike_Pence,",",",",",","
437,Greg Pence,RepGregPence,2021-06-20T18:46:33.000Z,"Dad is the greatest job title I’ve ever held.

Wishing a Happy Father’s Day to all the amazing Hoosier dads across Indiana’s Sixth District. 🇺🇸 https://t.co/UDjBqKSZbr",",",",",",",",https://t.co/UDjBqKSZbr,"
438,Greg Pence,RepGregPence,2021-06-20T16:20:58.000Z,"Great time at the Jennings County Fair meeting with constituents this week. Good to see Jennings County Sheriff Freeman and friends. 

Thanks to Jennings County Fair Board President Randy Shepherd for putting together a great week! https://t.co/uNxtqoYFCn",",",",",",",",https://t.co/uNxtqoYFCn,"
439,Greg Pence,RepGregPence,2021-06-19T20:23:32.000Z,Stopped by the Hancock County Fair this week. Enjoyed some fair food and got to speak with Hancock County constituents. Special thanks to Hancock County Sheriff’s department for their hospitality and keeping everyone safe! https://t.co/iALrFOicMw,",",",",",",",https://t.co/iALrFOicMw,"
