,Name,Twitter Handle,Time,Content,Retweeting,Hashtags,Tagged,Links
697,Bonnie Watson Coleman,RepBonnie,2021-06-19T15:00:02.000Z,"As we commemorate the importance of Juneteenth, let us also continue to work towards uplifting communities to ensure that Black Americans and all disenfranchised communities do not continue to wait for justice and equal opportunity. https://t.co/GFQ6PZG2IM",",",",",",",",https://t.co/GFQ6PZG2IM,"
698,Bonnie Watson Coleman,RepBonnie,2021-06-19T14:44:35.000Z,"RT @CrossConnection: .@RepBonnie and @Kassandra_Fred on the latest congressional effort to decriminalize all drugs, fifty years after Presi…",",CrossConnection,",",",",",","
699,Bonnie Watson Coleman,RepBonnie,2021-06-19T13:59:42.000Z,"@BethPassner Hi Beth, Please DM.",",",",",",BethPassner,",","
700,Bonnie Watson Coleman,RepBonnie,2021-06-19T13:22:12.000Z,"RT @CrossConnection: Coming up on The #CrossConnection:
@JoaquinCastroTX
@MsLatoshaBrown
@RepBonnie
@Kassandra_Fred
@Jelani9
@KAJ33
@ElieNY…",",CrossConnection,",",",",",","
701,Yvette Herrell,RepHerrell,2021-06-20T18:13:18.000Z,Happy Father’s Day to all the amazing dads out there. https://t.co/n4eAXQsy6B,",",",",",",",https://t.co/n4eAXQsy6B,"
702,Teresa Leger Fernandez,RepTeresaLF,2021-06-20T19:00:00.000Z,"During the summer, children face food insecurity without the support from schools to provide meals. The Summer Food Program provides nutritious meals to children ages 1 through 18. There are more than 700 locations across New Mexico. Find a location near you ⬇️ https://t.co/cdtJHs6xio",",",",",",",",https://t.co/cdtJHs6xio,"
703,Teresa Leger Fernandez,RepTeresaLF,2021-06-20T13:00:02.000Z,"Feliz día del padre!

Today we celebrate all the Dads who nurture, protect, and inspire us all. Thank you for your endless love. Happy Father’s day! https://t.co/93KMLMewsD",",",",",",",",https://t.co/93KMLMewsD,"
704,Teresa Leger Fernandez,RepTeresaLF,2021-06-19T14:00:02.000Z,"It's Juneteenth! We are celebrating across the country and in New Mexico as we work to dismantle the discrimination &amp; racism that unfortunately still lives in our country.
 
Let today fuel our fight towards racial justice. https://t.co/lNWTH2Nf2W",",",",",",",",https://t.co/lNWTH2Nf2W,"
705,Lee Zeldin,RepLeeZeldin,2021-06-20T15:49:31.000Z,"TONIGHT at 8 PM ET, I'll be on @FoxNews “Life, Liberty, and Levin” with @marklevinshow to discuss the urgent need to confront &amp; wipe out antisemitism and anti-Americanism. Be sure to tune in! https://t.co/x64ZpqWopY",",",",",",FoxNews,marklevinshow,",",https://t.co/x64ZpqWopY,"
706,Lee Zeldin,RepLeeZeldin,2021-06-20T13:17:54.000Z,"Happy #FathersDay2021 to all of the super hero dads out there, including my own. For many, being a father is the very greatest blessing in life, to teach, mentor, lead, and support our amazing sons and daughters. Enjoy your day! 😎",",",",FathersDay2021,",",",","
707,Lee Zeldin,RepLeeZeldin,2021-06-20T01:21:51.000Z,"RT @mikepompeo: “If we lose freedom here, there’s no place to escape to. This is the last stand on Earth.”
— President Ronald Reagan",",mikepompeo,",",",",",","
708,Lee Zeldin,RepLeeZeldin,2021-06-19T22:55:54.000Z,RT @DanScavino: https://t.co/8SiPxUcl9R,",DanScavino,",",",",",","
709,Andrew Garbarino,RepGarbarino,2021-06-20T15:13:52.000Z,Grateful for my dad today and every day. Happy Father’s Day to all the dads out there! https://t.co/NMqIMSH3Cv,",",",",",",",https://t.co/NMqIMSH3Cv,"
710,Andrew Garbarino,RepGarbarino,2021-06-19T14:04:00.000Z,"Happy Juneteenth! On this day in 1866, the last enslaved people in this country learned they were free. 

Thanks to an overwhelming vote this week, for the first time we are celebrating Juneteenth as a federal holiday. We must always remember and learn from our history. https://t.co/3plUhMusaw",",",",",",",",https://t.co/3plUhMusaw,"
711,Thomas Suozzi,RepTomSuozzi,2021-06-20T19:56:19.000Z,"Happy Father’s Day! Went to see Joe play in Florida for the @stluciemets. They won. Joe in RF batting 3rd. Went 2 for 5. Batting .305!
We are blessed with all of our children. First time I got to attend a game! https://t.co/YW3msCPWar",",",",",",stluciemets,",",https://t.co/YW3msCPWar,"
712,Thomas Suozzi,RepTomSuozzi,2021-06-20T16:27:30.000Z,"Happy Father’s Day!

I am so grateful for the gift of my father. He was the best man at our wedding and the best man I ever knew.

Wishing all fathers my best wishes. https://t.co/1tsgWv89fl",",",",",",",",https://t.co/1tsgWv89fl,"
713,Thomas Suozzi,RepTomSuozzi,2021-06-19T16:53:24.000Z,"The struggle for justice has been long, but it will not be denied. This year, as we recognize Juneteenth as a federal holiday, let us recommit ourselves to working together to enact real reforms to create a more equal, fair, and just society.
https://t.co/omkwuVnDRN",",",",",",",",https://t.co/omkwuVnDRN,"
714,Kathleen Rice,RepKathleenRice,2021-06-20T14:52:42.000Z,Happy #FathersDay to all of the great dads in #NY04. Enjoy your day!,",",",FathersDay,NY04,",",",","
715,Kathleen Rice,RepKathleenRice,2021-06-19T14:20:16.000Z,"Today we commemorate #Juneteenth, the anniversary of when slavery ended in the United States. Let us all take time today to learn about this moment in our history. https://t.co/xk3yf1GLea",",",",Juneteenth,",",",",https://t.co/xk3yf1GLea,"
716,Gregory Meeks,RepGregoryMeeks,2021-06-20T18:38:57.000Z,Wishing all the dads out there a happy #FathersDay!,",",",FathersDay,",",",","
717,Gregory Meeks,RepGregoryMeeks,2021-06-20T14:17:54.000Z,"RT @HouseForeign: On this #WorldRefugeeDay, we acknowledge the number of people forcibly displaced reached a record 82.4 million.

Under th…",",HouseForeign,",",",",",","
718,Gregory Meeks,RepGregoryMeeks,2021-06-19T18:51:48.000Z,"RT @QnsBPRichards: Today is a day to celebrate how far we’ve come, but to also look back and honor the enslaved and empowered who helped ge…",",QnsBPRichards,",",",",",","
719,Gregory Meeks,RepGregoryMeeks,2021-06-19T18:00:45.000Z,RT @RepWilson: Still feeling the joy from the day we witnessed @POTUS signing the landmark #Juneteenth National Independence Day Act. It wa…,",RepWilson,",",",",",","
720,Gregory Meeks,RepGregoryMeeks,2021-06-19T17:48:08.000Z,"Happy #Juneteenth! Today we reflect on those formerly enslaved who experienced freedom for the first time, while continuing to dismantle the remnants and legacy of America's original sin. https://t.co/puhQckb1YI",",",",Juneteenth,",",",",https://t.co/puhQckb1YI,"
721,Grace Meng,RepGraceMeng,2021-06-20T14:23:55.000Z,"Happy #FathersDay! Today, we honor and thank dads across our nation for inspiring us and pushing us forward. Thank you for all you do. I wish dads everywhere a happy and safe celebration.",",",",FathersDay,",",",","
722,Nydia Valázquez,NydiaVelazquez,2021-06-20T16:19:42.000Z,"Wishing a very happy #FathersDay to all the dads in my district and throughout the country. 

My father was one of many who worked hard so his kids could have a better life. As a sugarcane worker who became an activist he taught me the value in fighting for change. https://t.co/HGACbcwZes",",",",FathersDay,",",",",https://t.co/HGACbcwZes,"
723,Nydia Valázquez,NydiaVelazquez,2021-06-19T14:00:00.000Z,"Today we celebrate justice.

On June 19, 1865, African American slaves in the South were finally emancipated, and going forward we will recognize this date as a federal holiday. 

Though we have come far, we must keep fighting for justice for the black community in America. https://t.co/ahGUjgsY5a",",",",",",",",https://t.co/ahGUjgsY5a,"
724,Hakeem Jeffries,RepJeffries,2021-06-20T14:27:38.000Z,"Thankful for all of the Dads throughout America holding down their families. 

Happy Father’s Day!!! https://t.co/8hroYszhaV",",",",",",",",https://t.co/8hroYszhaV,"
725,Hakeem Jeffries,RepJeffries,2021-06-19T15:47:40.000Z,"Happy Juneteenth!!!

“If there is no struggle, there is no progress.” - Frederick Douglass",",",",",",",","
726,Yvette Clark,RepYvetteClarke,2021-06-20T15:28:40.000Z,Wishing all the Father's everywhere — especially my Father Lesley Clarke —  a Happy #FathersDay! https://t.co/G6vlSTAWBz,",",",FathersDay,",",",",https://t.co/G6vlSTAWBz,"
727,Yvette Clark,RepYvetteClarke,2021-06-19T14:13:16.000Z,Happy #Juneteenth! https://t.co/zBkT23doIH,",",",Juneteenth,",",",",https://t.co/zBkT23doIH,"
728,Nicole Malliotakis,RepMalliotakis,2021-06-19T18:03:53.000Z,Nicole joined the local festivities at @SnugHarborCCBG this morning to commemorate #JuneTeenth2021. It was great to see so many local organizations out celebrating the end of slavery in the #USA. https://t.co/mQxEhETU9G,",",",JuneTeenth2021,USA,",",SnugHarborCCBG,",",https://t.co/mQxEhETU9G,"
729,Nicole Malliotakis,RepMalliotakis,2021-06-19T16:53:27.000Z,"Nicole joined the #StatenIsland Tuna Club for World Oceans Day 🌊 as they presented a $92k check to @statenislandzoo. Many of our cultural institutions suffered due to the pandemic so this boost from the community was much appreciated!

@WorldOceansDay https://t.co/thKNisidvD",",",",StatenIsland,",",statenislandzoo,WorldOceansDay,",",https://t.co/thKNisidvD,"
730,Carolyn Maloney,RepMaloney,2021-06-20T21:49:34.000Z,"RT @OversightDems: “It was not a tourist visit to the Capitol. It was an armed riot at the Capitol.” 

—Chair @RepMaloney on why Congress n…",",OversightDems,",",",",",","
731,Carolyn Maloney,RepMaloney,2021-06-20T21:43:13.000Z,"Wishing every father, grandfather, stepdad, and father figure a very Happy #FathersDay. I hope you all have a great day with your loved ones. https://t.co/T4nzYDqyeX",",",",FathersDay,",",",",https://t.co/T4nzYDqyeX,"
732,Carolyn Maloney,RepMaloney,2021-06-20T01:53:24.000Z,"I just got home from celebrating Juneteenth w/ @stnicksalliance, Cooper Park RA President Debra Benders, &amp; Elisha Fye. 

Today, we celebrate. Tomorrow, we get back to work to pass CRITICAL legislation like the George Floyd Justice in Policing &amp; the John Lewis Voting Rights Act. https://t.co/JQse8ZfXAf",",",",",",stnicksalliance,",",https://t.co/JQse8ZfXAf,"
733,Carolyn Maloney,RepMaloney,2021-06-19T21:05:13.000Z,"Juneteenth is an occasion for celebration and for doing the work to replace the lasting effects of slavery and racism with hope, dignity, and true equality for all. 
 
We can start with the Senate passing the #GeorgeFloydAct, and finally making the #JohnLewisVotingRightsAct law. https://t.co/ATneZaEZyQ",",",",GeorgeFloydAct,JohnLewisVotingRightsAct,",",",",https://t.co/ATneZaEZyQ,"
734,Carolyn Maloney,RepMaloney,2021-06-19T18:48:02.000Z,"THIS WEEKEND are the last 2 days to vote early in the June primary. 

The polls are open from 10am - 5pm. 
 
https://t.co/NQfmrp9P6r",",",",",",",",https://t.co/NQfmrp9P6r,"
735,Carolyn Maloney,RepMaloney,2021-06-19T18:47:48.000Z,https://t.co/Lw3tD1iPLt,",",",",",",",https://t.co/Lw3tD1iPLt,"
736,Carolyn Maloney,RepMaloney,2021-06-19T18:47:38.000Z,Was great to see so many of you for mobile casework hours this morning in McGorlick Park. My staff and I will be continuing to offer mobile casework hours throughout NY-12 – stay tuned for our next stop! https://t.co/g1Inb3QFBw,",",",",",",",https://t.co/g1Inb3QFBw,"
737,Carolyn Maloney,RepMaloney,2021-06-19T13:54:55.000Z,"RT @OversightDems: In honor of the 1st federally recognized #Juneteenth, Chair @RepMaloney has a special holiday message: https://t.co/KnOG…",",OversightDems,",",",",",","
738,Adriano Espaillat,RepEspaillat,2021-06-20T16:20:16.000Z,"RT @RepEspaillat: So far, Republicans have introduced 389 voter suppression bills in 48 states around the country. 

Our democracy is on th…",",RepEspaillat,",",",",",","
739,Adriano Espaillat,RepEspaillat,2021-06-20T13:45:00.000Z,"To all of the dads out there, including all the father figures and mentors in our children's lives, today we say thank you. 
 
Happy #FathersDay! https://t.co/oYmOmVzsOO",",",",FathersDay,",",",",https://t.co/oYmOmVzsOO,"
740,Adriano Espaillat,RepEspaillat,2021-06-20T12:40:21.000Z,"Not bad for 5:30 in the morning. 🤦🏽‍♂️ 

I’ll take it! https://t.co/2W79TXMbXP",",",",",",",",https://t.co/2W79TXMbXP,"
741,Adriano Espaillat,RepEspaillat,2021-06-20T12:30:00.000Z,"So far, Republicans have introduced 389 voter suppression bills in 48 states around the country. 

Our democracy is on the line if we don’t abolish the filibuster. https://t.co/8YnQn58hF5",",",",",",",",https://t.co/8YnQn58hF5,"
742,Adriano Espaillat,RepEspaillat,2021-06-20T10:03:40.000Z,"Looking forward to my segment with @MSNBC’s @kendisgibson and @CoriCoffin this morning. 

Tune in now to watch! 📺",",",",",",MSNBCs,kendisgibson,CoriCoffin,",","
743,Adriano Espaillat,RepEspaillat,2021-06-19T17:20:17.000Z,"RT @RepEspaillat: Zoom had its profits increase 4000% just last year.

There’s literally no reason they shouldn’t be paying more than $0 in…",",RepEspaillat,",",",",",","
744,Adriano Espaillat,RepEspaillat,2021-06-19T14:00:26.000Z,RT @RepEspaillat: We have no choice: we have to face our nation’s history of brutality and injustice before we can build a future of true f…,",RepEspaillat,",",",",",","
745,Adriano Espaillat,RepEspaillat,2021-06-19T13:00:26.000Z,"Zoom had its profits increase 4000% just last year.

There’s literally no reason they shouldn’t be paying more than $0 in income taxes.",",",",",",",","
746,Adriano Espaillat,RepEspaillat,2021-06-19T12:55:14.000Z,"RT @POTUS: Today, we’ve passed 300 million shots in 150 days. 
When I took office, our nation was in crisis. Today, the virus is in retreat…",",POTUS,",",",",",","
747,Alexandria Ocasio-Cortez,RepAOC,2021-06-19T21:25:57.000Z,"Today, we celebrate Juneteenth, which marks and celebrates the end of slavery in the United States. 

But we're still confronting the truth about our history and the injustices we still face — including deadly police violence and voter suppression. 

There's still work to do. https://t.co/hfikGPJq8A",",",",",",",",https://t.co/hfikGPJq8A,"
748,Ritchie Torres,RepRitchie,2021-06-20T21:08:15.000Z,"RT @KevinFreyTV: “Every time I set foot on the House floor, I cannot help but feel the weight of history on my shoulders.""

@RepRitchie, th…",",KevinFreyTV,",",",",",","
749,Ritchie Torres,RepRitchie,2021-06-20T20:02:30.000Z,"Wishing all of the men who have made us who we are- our fathers, uncles, grandfathers, neighbors- a very #HappyFathersDay. We celebrate you &amp; thank you for your hard work &amp; care. https://t.co/BohUpY4OcC",",",",HappyFathersDay,",",",",https://t.co/BohUpY4OcC,"
750,Ritchie Torres,RepRitchie,2021-06-19T22:55:05.000Z,"Happy #Juneteenth. It took 156 years to give emancipation the long overdue recognition it deserves. Let’s take this day to recommit ourselves to the continued fight for freedom, equality, and racial justice in our country and around the world. https://t.co/poPP5JHHav",",",",Juneteenth,",",",",https://t.co/poPP5JHHav,"
751,Jamaal Bowman,RepBowman,2021-06-20T17:22:26.000Z,Wishing you a safe and happy Father’s Day! Sending love to fathers and father figures in NY-16 and everywhere.,",",",",",",","
752,Jamaal Bowman,RepBowman,2021-06-19T23:40:25.000Z,"From Ardsley, the Bronx, Mount Vernon, and Yonkers the omnipresent spirit of Black joy and pride flowed through the streets. 

As we commemorate the end of slavery over 100 years ago, we also rejoice at the Black experience while working towards more equality for all. https://t.co/xYCT5nP1jx",",",",",",",",https://t.co/xYCT5nP1jx,"
753,Jamaal Bowman,RepBowman,2021-06-19T18:07:00.000Z,"It’s always a good time when we can gather, as a community, to enjoy a peaceful afternoon. 

Thank you @GoodShepherdNYC’s Bronx Rises Against Gun Violence program for the work you are doing throughout the Bronx and for cultivating a space of peace on this Juneteenth! https://t.co/EXBAWXAsFS",",",",",",GoodShepherdNYCs,",",https://t.co/EXBAWXAsFS,"
754,Jamaal Bowman,RepBowman,2021-06-19T16:14:52.000Z,"Honored to join @vcpalliance along with @JeffreyDinowitz and @EricDinowitzNYC  to honor the enslaved ancestors whose contributions can still be seen and felt in Van Cortlandt Park until today.

 May they rest in power! https://t.co/okshKZU2yO",",",",",",vcpalliance,JeffreyDinowitz,EricDinowitzNYC,",",https://t.co/okshKZU2yO,"
755,Jamaal Bowman,RepBowman,2021-06-19T16:12:24.000Z,@jeremycv @ChildrensVllg Always a pleasure!,",",",",",jeremycv,ChildrensVllg,",","
756,Mondaire Jones,RepMondaire,2021-06-20T18:45:12.000Z,"As America confronts a disturbing rise in anti-Asian hate, the FBI's alleged misconduct in the case of Professor Anming Hu is deeply troubling.

@TedLieu, @RepJayapal, and I have referred the case to the DOJ's Inspector General to demand answers and accountability. https://t.co/so11IlUJEa",",",",",",TedLieu,RepJayapal,",",https://t.co/so11IlUJEa,"
757,Mondaire Jones,RepMondaire,2021-06-20T16:08:00.000Z,"The past four years of xenophobic rhetoric and policies have decimated our refugee admission system.

#WorldRefugeeDay is a reminder of our obligation to rebuild capacity so we can once again welcome tens of thousands of refugees to the U.S. every year.
https://t.co/pYQtXa3jBQ",",",",WorldRefugeeDay,",",",",https://t.co/pYQtXa3jBQ,"
758,Mondaire Jones,RepMondaire,2021-06-20T14:24:03.000Z,Happy #FathersDay to all the dads and father figures!,",",",FathersDay,",",",","
759,Mondaire Jones,RepMondaire,2021-06-19T15:52:50.000Z,"Ms. Opal Lee has been working for decades to make Juneteenth a national holiday.

As we celebrate #Juneteenth as a federal holiday for the first time, I'm thinking of her and all the freedom fighters committed to the work of liberation.
https://t.co/zBpva52sNl",",",",Juneteenth,",",",",https://t.co/zBpva52sNl,"
760,Sean Patrick Maloney,RepSeanMaloney,2021-06-20T23:00:00.000Z,Happy #Pride! https://t.co/KncmnIVFyu,",",",Pride,",",",",https://t.co/KncmnIVFyu,"
761,Sean Patrick Maloney,RepSeanMaloney,2021-06-20T14:00:02.000Z,"Being a dad to my three kids is the greatest blessing in my life. Thank you, Randy, for joining me on this adventure. Wishing all the dads out there a Happy #FathersDay! https://t.co/ETqbjiwyrd",",",",FathersDay,",",",",https://t.co/ETqbjiwyrd,"
762,Sean Patrick Maloney,RepSeanMaloney,2021-06-19T22:00:01.000Z,"Anti-LGBTQ violence is too common– it happens when a trans woman of color is killed, it happens when a young gay person is bullied &amp; takes his own life. We have to get more data on when/where/why this happening so we can stop it. The LGBTQ #EssentialDataAct is a crucial 1st step. https://t.co/PpAqsXIf3X",",",",EssentialDataAct,",",",",https://t.co/PpAqsXIf3X,"
763,Sean Patrick Maloney,RepSeanMaloney,2021-06-19T19:00:01.000Z,"As our nation works to heal &amp; grow from the trauma of our past, #Juneteenth National Independence Day should serve as a reminder of where we have been so we can realize a better future. We must honor the vitality of Americans, stand against bigotry &amp; continue to demand justice. https://t.co/P4N8LGLTJM",",",",Juneteenth,",",",",https://t.co/P4N8LGLTJM,"
764,Sean Patrick Maloney,RepSeanMaloney,2021-06-19T14:29:25.000Z,"#OTD in 1865, the remaining enslaved Americans in Texas learned of their freedom. As we celebrate #Juneteenth let us remember that the fight for racial justice must continue in order to achieve equality and justice for all. https://t.co/pjxuKoD7f0",",",",OTD,Juneteenth,",",",",https://t.co/pjxuKoD7f0,"
765,Sean Patrick Maloney,RepSeanMaloney,2021-06-19T14:18:18.000Z,The epidemic of violence against transgender Americans – particularly transgender women of color – is getting worse. My bill will help us collect the data necessary to fully support the LGBTQ community. We must act now and help save lives. #EssentialDataAct https://t.co/2PiVBEt4nV,",",",EssentialDataAct,",",",",https://t.co/2PiVBEt4nV,"
766,Antonio Delgado,repdelgado,2021-06-20T13:59:43.000Z,Happy #FathersDay to all the dads and father figures in #NY19. https://t.co/bwVOtevvhX,",",",FathersDay,NY19,",",",",https://t.co/bwVOtevvhX,"
767,Antonio Delgado,repdelgado,2021-06-19T21:01:10.000Z,"Here's a quick recap of my week: 
 
✅ Voted to make #Juneteenth a federal holiday
✅ Voted to repeal the 2002 AUMF
✅ Chaired my first @HouseAgDems Subcommittee hearing
✅ Received the @USChamber Jefferson-Hamilton Award for Bipartisanship for the second year in a row",",",",Juneteenth,",",HouseAgDems,USChamber,",","
768,Antonio Delgado,repdelgado,2021-06-19T18:27:09.000Z,Great to be at the Harambee Juneteenth Celebration in Kingston where I had the honor of recognizing the tremendous work of Tyrone Wilson and Harambee to protect and preserve the Pine Street African Burial Ground. #Juneteenth. https://t.co/I727iF92gr,",",",Juneteenth,",",",",https://t.co/I727iF92gr,"
769,Antonio Delgado,repdelgado,2021-06-19T15:52:40.000Z,"It was an honor to attend the Jack Rose Fallen First Responders Memorial Dedication, where we commemorated the lives of 4 first responders from Saugerties who died in the line of duty. We are eternally grateful for their sacrifice and service. https://t.co/Xb88VKjf1u",",",",",",",",https://t.co/Xb88VKjf1u,"
770,Paul Tonko,RepPaulTonko,2021-06-19T13:34:29.000Z,"Today we celebrate the triumph of justice over injustice and of freedom over bondage. 

My latest newsletter highlights the powerful history of #Juneteenth and the vital importance of continuing to work towards a vision of a better America for all.

https://t.co/uqXp8SdDqq",",",",Juneteenth,",",",",https://t.co/uqXp8SdDqq,"
771,Elise Stefanik,RepStefanik,2021-06-20T14:06:37.000Z,Happy Father’s Day to all #NY21 dads! https://t.co/PRvBxHxCrl,",",",NY21,",",",",https://t.co/PRvBxHxCrl,"
772,Elise Stefanik,RepStefanik,2021-06-19T12:57:02.000Z,"Today, we celebrate the freedom of all slaves at the end of the Civil War.

May we continue to learn from our nation’s history as we work together to build a more perfect union. https://t.co/VPiB9i4ELI",",",",",",",",https://t.co/VPiB9i4ELI,"
773,Claudia Tenney,RepTenney,2021-06-20T20:38:00.000Z,"The Federal Reserve released their inflation predictions and guess what? 

They adjusted them a 𝐅𝐔𝐋𝐋 percent 𝐇𝐈𝐆𝐇𝐄𝐑 than previously anticipated. 

President Biden is driving America right into an economic crisis. He needs to correct course immediately. https://t.co/79UviHhANh",",",",",",",",https://t.co/79UviHhANh,"
774,Claudia Tenney,RepTenney,2021-06-20T19:42:00.000Z,"ICYMI: This week I introduced the Remembering our Local Heroes Act in Congress. 

Our military, firefighters, and police should be memorialized for their heroic actions and this bill helps accomplish that goal. 

Learn more: https://t.co/6gQPs7HZPP",",",",",",",",https://t.co/6gQPs7HZPP,"
775,Claudia Tenney,RepTenney,2021-06-20T17:59:00.000Z,"Does CNN stand for China News Network? I didn’t think so. Then why is an American news outlet carrying the water for the Chinese Communist Party?

https://t.co/1l0VgNQ2or",",",",",",",",https://t.co/1l0VgNQ2or,"
776,Claudia Tenney,RepTenney,2021-06-20T16:21:00.000Z,"June is Alzheimer’s awareness month and over 6 million Americans are living with Alzheimer’s today. 

In New York alone, 410,000 people 65 and older lived with Alzheimer’s in 2020. I’m committed to fighting this disease and supporting research to find a cure. https://t.co/HTCzfm1nga",",",",",",",",https://t.co/HTCzfm1nga,"
777,Claudia Tenney,RepTenney,2021-06-20T15:25:47.000Z,"Officer Guy Danella has faithfully served his community as a police officer for more than 23 years. I was honored to join him to celebrate his service as he retires. 

I wish him all the best as he embarks on this next chapter. https://t.co/seTWpE9z5p",",",",",",",",https://t.co/seTWpE9z5p,"
778,Claudia Tenney,RepTenney,2021-06-19T19:44:00.000Z,"My weekly newsletter is out with important updates for #NY22. Click the link below in case you missed it!

https://t.co/4AOPmBlV0X",",",",NY22,",",",",https://t.co/4AOPmBlV0X,"
779,Claudia Tenney,RepTenney,2021-06-19T18:08:00.000Z,"President Biden stated yesterday that the “sacred right to vote remains under attack”. 

Yes it is Mr. President, but it’s from your own administration. Bills like HR 1 &amp; HR 4 would take rights away from states &amp; concentrate more power in the hands of bureaucrats. https://t.co/8y0lf6lw1p",",",",",",",",https://t.co/8y0lf6lw1p,"
780,Claudia Tenney,RepTenney,2021-06-19T15:54:24.000Z,"🚨Election Integrity Update🚨

New polling is out from Pennsylvania:
✅64% of PA voters STRONGLY favor voter ID
✅61% of PA voters STRONGLY favor signature matching for mail-in ballots

Read more👇
https://t.co/zshn2BAaVz",",",",",",",",https://t.co/zshn2BAaVz,"
781,Claudia Tenney,RepTenney,2021-06-19T15:29:00.000Z,"ICYMI: I released an op-ed this week highlighting the very real dangers of HR 4, which some Democrats now support as a replacement to HR 1. Read more below! 

https://t.co/70mkfjk7Xy",",",",",",",",https://t.co/70mkfjk7Xy,"
782,Claudia Tenney,RepTenney,2021-06-19T14:07:25.000Z,"Today we celebrate Juneteenth, a historic day that marks the end of slavery. Let us reflect on this day, acknowledge the tremendous progress that has been made since, and continue working together as one to ensure this remains the greatest nation for generations to come. https://t.co/dFarAXjuO2",",",",",",",",https://t.co/dFarAXjuO2,"
783,Joseph Morelle,RepJoeMorelle,2021-06-20T16:04:02.000Z,"The COVID-19 pandemic showed us how valuable it can be to interface with a doctor from the comfort of our own homes.

That is why I am proud to support the Telehealth Modernization Act and ensure telehealth remains an option for patients into the future. https://t.co/BrPcBpEIyS",",",",",",",",https://t.co/BrPcBpEIyS,"
784,Joseph Morelle,RepJoeMorelle,2021-06-20T11:40:01.000Z,"Being a father and grandfather have been the greatest joys of my life.

To all the dads in our community: Happy Father's Day! https://t.co/VjEvFlmuQ0",",",",",",",",https://t.co/VjEvFlmuQ0,"
